{
  "id": "s4-cli-completeness",
  "title": "S4: CLI Completeness Sprint",
  "intent": "Implement the CLI disable command and any remaining command stubs to achieve feature parity. The disable command is entirely TODO stubs — needs: verify module is Enabled, display toggle diff, prompt confirmation, call ModuleRegistry.disable(), rebuild snapshot. This sprint runs in parallel with S2 and S3.",
  "change_class": "local",
  "scope": {
    "packages": ["@archon/cli"],
    "files_hint": ["packages/cli/src/commands/disable.ts", "packages/cli/src/commands/"],
    "phase_ref": null
  },
  "owner": "operator",
  "created_at": "2026-03-18T18:00:00Z",
  "started_at": "2026-03-18T19:00:00Z",
  "environment_dependencies": [],
  "tags": ["v0.1", "parallel", "domain-cli"]
}
