{
  "id": "s3-module-loading-pipeline",
  "title": "S3: Module Loading Pipeline Sprint",
  "intent": "Complete ModuleValidator manifest validation and ModuleLoader hash verification + DSL compilation. ModuleValidator is entirely TODO stubs. ModuleLoader has hash verification and DSL validation stubs. This sprint makes the full module loading pipeline operational: read manifest → validate → hash verify → compile DSL → register as Disabled. Runs in parallel with S2 and S4.",
  "change_class": "local",
  "scope": {
    "packages": ["@archon/module-loader"],
    "files_hint": ["packages/module-loader/src/validator.ts", "packages/module-loader/src/loader.ts", "packages/module-loader/test/"],
    "phase_ref": null
  },
  "owner": "operator",
  "created_at": "2026-03-18T18:00:00Z",
  "started_at": "2026-03-18T19:00:00Z",
  "environment_dependencies": [],
  "tags": ["v0.1", "parallel", "domain-module-loader"]
}
