{
  "id": "factory-bootstrap-derivation",
  "title": "Implement factory derivation and validation scripts (F2+F3)",
  "intent": "Create tools/factory/derive.ts and tools/factory/validate.ts. The derivation script computes factory state from artifacts. The validation script enforces schema, referential integrity, and factory invariants FI-1 through FI-5. Wire into CI as advisory (non-blocking).",
  "change_class": "local",
  "scope": {
    "packages": [],
    "files_hint": ["tools/factory/", "package.json", ".github/workflows/ci.yml"],
    "phase_ref": null
  },
  "owner": "operator",
  "created_at": "2026-03-18T12:00:00Z",
  "started_at": "2026-03-18T13:00:00Z",
  "environment_dependencies": [],
  "tags": ["factory", "bootstrap"]
}
