{
  "id": "s1-dsl-implementation",
  "title": "S1: DSL Implementation Sprint (Foundation)",
  "intent": "Complete the restriction DSL parser and compiler. The DSL is the substrate for restriction rules — ModuleLoader validates DSL strings, IC-1 tests restriction monotonicity. Without a working DSL pipeline, neither can be completed. This sprint unblocks all parallel domain sprints (S2, S3, S4) and the acceptance sprint (S5).",
  "change_class": "cross_cutting",
  "scope": {
    "packages": ["@archon/restriction-dsl"],
    "files_hint": ["packages/restriction-dsl/src/parser.ts", "packages/restriction-dsl/src/compiler.ts", "packages/restriction-dsl/test/"],
    "phase_ref": null
  },
  "owner": "operator",
  "created_at": "2026-03-18T18:00:00Z",
  "started_at": "2026-03-18T18:00:00Z",
  "environment_dependencies": [],
  "tags": ["v0.1", "foundation", "blocking"]
}
