{
  "id": "factory-bootstrap-structure",
  "title": "Introduce factory directory structure and JSON schemas (F1)",
  "intent": "Create the factory/ directory with schemas for packets, completions, acceptances, rejections, and evidence. Establish the structural foundation for the factory system without introducing any behavior.",
  "change_class": "local",
  "scope": {
    "packages": [],
    "files_hint": ["factory/", ".gitignore"],
    "phase_ref": null
  },
  "owner": "operator",
  "created_at": "2026-03-18T12:00:00Z",
  "started_at": "2026-03-18T12:00:00Z",
  "environment_dependencies": [],
  "tags": ["factory", "bootstrap"]
}
