{
  "id": "ic-5-no-self-enable-scan",
  "title": "Implement IC-5: No Module Auto-Enables Itself",
  "intent": "Implement the IC-5 invariant check as specified in tools/ci/invariant-checks.md. Static scan verifying that no module manifest in modules/ sets default_enabled: true on any capability descriptor. Replaces the IC-5 stub in CI with a real enforcement gate.",
  "change_class": "local",
  "scope": {
    "packages": ["tools/ci"],
    "files_hint": ["tools/ci/check-ic5-no-self-enable.sh", ".github/workflows/ci.yml"],
    "phase_ref": null
  },
  "owner": "operator",
  "created_at": "2026-03-18T17:00:00Z",
  "started_at": "2026-03-18T17:00:00Z",
  "environment_dependencies": [],
  "tags": ["invariant-check", "v0.1-blocker", "ci"]
}
