{
  "id": "s5-acceptance-integration",
  "title": "S5: Acceptance & Integration Sprint",
  "intent": "Implement IC-1 (restriction monotonicity), IC-2 (snapshot determinism), IC-3 (delegation non-escalation) as real CI enforcement gates. Run end-to-end integration verification: load module via ModuleLoader → enable via governance APIs → execute via gate → verify decision log queryable. Remove the remaining CI stub. Mark all five IC checks as IMPLEMENTED in tools/ci/invariant-checks.md. This sprint confirms v0.1 readiness.",
  "change_class": "cross_cutting",
  "scope": {
    "packages": ["tools/ci"],
    "files_hint": ["tools/ci/check-ic1-monotonicity.sh", "tools/ci/check-ic2-snapshot-determinism.sh", "tools/ci/check-ic3-delegation.sh", ".github/workflows/ci.yml", "tools/ci/invariant-checks.md"],
    "phase_ref": null
  },
  "owner": "operator",
  "created_at": "2026-03-18T18:00:00Z",
  "started_at": "2026-03-18T20:00:00Z",
  "environment_dependencies": [],
  "tags": ["v0.1", "acceptance", "blocking"]
}
