{
  "id": "ic-4-kernel-boundary-analysis",
  "title": "Implement IC-4: No Module Alters Kernel Enforcement Logic",
  "intent": "Implement the IC-4 invariant check as specified in tools/ci/invariant-checks.md. Static analysis script verifying that no module package imports from kernel validation or snapshot internals, and that modules cannot register hooks into enforcement logic. Replaces the IC-4 stub in CI with a real enforcement gate.",
  "change_class": "local",
  "scope": {
    "packages": ["tools/ci"],
    "files_hint": ["tools/ci/check-ic4-kernel-boundary.sh", ".github/workflows/ci.yml"],
    "phase_ref": null
  },
  "owner": "operator",
  "created_at": "2026-03-18T17:00:00Z",
  "started_at": "2026-03-18T17:00:00Z",
  "environment_dependencies": [],
  "tags": ["invariant-check", "v0.1-blocker", "ci"]
}
